{
  "schemaVersion": 1,
  "id": "workbench-kit.samples.field-remap",
  "name": "samples-field-remap",
  "displayName": "Field Remap",
  "version": "0.0.0",
  "publisher": "workbench-kit",
  "engines": {
    "workbench": "^0.0.0",
    "extensionApi": "^0.0.0"
  },
  "activationEvents": ["onView:workbench-kit.samples.field-remap.panel"],
  "contributes": {
    "viewContainers": {
      "activitybar": [
        {
          "id": "fieldRemap",
          "title": "Field Remap",
          "icon": "type-hierarchy",
          "order": 36
        }
      ]
    },
    "activities": [
      {
        "id": "workbench-kit.samples.field-remap.activity",
        "viewContainerId": "fieldRemap",
        "icon": "type-hierarchy",
        "title": "Field Remap",
        "order": 36
      }
    ],
    "views": {
      "fieldRemap": [
        {
          "id": "workbench-kit.samples.field-remap.panel",
          "name": "Field Remap"
        }
      ]
    },
    "editors": [
      {
        "id": "workbench-kit.samples.field-remap.editor",
        "label": "Field Remap",
        "icon": "type-hierarchy"
      }
    ]
  }
}
