{
  "schemaVersion": 1,
  "id": "workbench-kit.builtin.editor",
  "name": "builtin-editor",
  "displayName": "Text Editor",
  "version": "0.0.0",
  "publisher": "workbench-kit",
  "engines": {
    "workbench": "^0.0.0",
    "extensionApi": "^0.0.0"
  },
  "activationEvents": ["onStartup"],
  "contributes": {
    "documentViews": [
      {
        "id": "workbench-kit.builtin.editor.markdown-preview",
        "kind": "preview",
        "label": "Preview",
        "priority": 5,
        "filenamePatterns": ["*.md", "*.mdx"],
        "mimeTypes": ["text/markdown"]
      }
    ],
    "editors": [
      {
        "id": "workbench-kit.builtin.editor.text",
        "label": "Text Editor",
        "icon": "file"
      }
    ]
  }
}
