{
  "schemaVersion": 1,
  "id": "workbench-kit.samples.locale-ko",
  "name": "samples-locale-ko",
  "displayName": "Korean Locale Pack",
  "version": "0.0.0",
  "publisher": "workbench-kit",
  "engines": {
    "workbench": "^0.0.0",
    "extensionApi": "^0.0.0"
  },
  "activationEvents": ["onStartup"],
  "contributes": {
    "localizations": [
      {
        "locale": "ko",
        "label": "Korean",
        "translations": {
          "activityBar.explorer": "탐색기",
          "activityBar.search": "검색",
          "activityBar.chat": "채팅",
          "activityBar.commands": "명령",
          "shell.activityBar": "작업 표시줄",
          "shell.statusBar": "상태 표시줄",
          "shell.profile": "프로필",
          "shell.profileTitle": "프로필 열기",
          "shell.settings": "설정",
          "commandPalette.title": "명령 팔레트",
          "commandPalette.placeholder": "명령 검색",
          "commandPalette.close": "명령 팔레트 닫기",
          "commandPalette.empty": "일치하는 명령이 없습니다",
          "quickOpen.title": "빠른 열기",
          "quickOpen.placeholder": "파일 이름으로 검색",
          "quickOpen.close": "빠른 열기 닫기",
          "quickOpen.empty": "일치하는 파일이 없습니다",
          "settings.appearance": "모양",
          "settings.colorTheme": "색 테마",
          "settings.displayLanguage": "표시 언어",
          "settings.extensions": "확장",
          "settings.installed": "설치됨",
          "settings.browse": "찾아보기"
        }
      }
    ]
  }
}
