{
  "schemaVersion": 1,
  "id": "workbench-kit.builtin.commands",
  "name": "builtin-commands",
  "displayName": "Commands",
  "version": "0.0.0",
  "publisher": "workbench-kit",
  "engines": {
    "workbench": "^0.0.0",
    "extensionApi": "^0.0.0"
  },
  "activationEvents": ["onView:workbench-kit.builtin.commands.panel"],
  "contributes": {
    "commands": [
      {
        "command": "workbench-kit.builtin.commands.focus",
        "title": "Focus Commands Sidebar",
        "category": "Workbench"
      },
      {
        "command": "workbench-kit.builtin.commands.refresh",
        "title": "Refresh Command Registry",
        "category": "Workbench"
      }
    ],
    "viewContainers": {
      "activitybar": [
        {
          "id": "commands",
          "title": "Commands",
          "icon": "terminal",
          "order": 25
        }
      ]
    },
    "activities": [
      {
        "id": "workbench-kit.builtin.commands.activity",
        "viewContainerId": "commands",
        "icon": "terminal",
        "title": "Commands",
        "order": 25
      }
    ],
    "views": {
      "commands": [
        {
          "id": "workbench-kit.builtin.commands.panel",
          "name": "Commands"
        }
      ]
    },
    "menus": {
      "view/title": [
        {
          "command": "workbench-kit.builtin.commands.refresh",
          "group": "navigation",
          "when": "view == workbench-kit.builtin.commands.panel"
        }
      ]
    }
  }
}
